PuzzleId,FEN,Moves,Rating,RatingDeviation,Popularity,NbPlays,Themes,GameUrl,OpeningTags
uXimL,8/1K1k4/3P4/p1P5/P7/2b5/8/8 w - - 7 75,d8d7 c5c6 d7d6 c6c7,509,113,100,24,advancedPawn bishopEndgame crushing endgame short,https://lichess.org/QeBwO3cw/black#148,
YXRiP,8/p1b1kp2/6p1/2PP3p/3P4/2K2P1P/P5P1/8 w - - 1 31,f8e7 d5d6 c7d6 c5d6,513,93,100,334,bishopEndgame crushing endgame fork short,https://lichess.org/0ECv411C/black#60,
cmkqh,8/1p6/2p2pk1/p1b1p2p/P3P2K/2P2P1B/1P3P2/8 b - - 8 52,f1h3 c5f2,515,97,100,623,bishopEndgame endgame master mate mateIn1 oneMove,https://lichess.org/IiBWa6z0#103,
HEG59,8/8/5p1p/p2b1kpP/P2Pp3/1p2P1K1/1P2B3/8 w - - 0 38,h7h6 e2g4,523,90,100,55,bishopEndgame endgame master mate mateIn1 oneMove,https://lichess.org/QtNXtYmu/black#74,
xa2VK,8/2p3k1/1p3pB1/1PpP1P1K/8/8/8/8 b - - 4 63,f7g6 c5c4 h5g4 c4c3,527,82,100,141,bishopEndgame crushing endgame quietMove short,https://lichess.org/vDqei15P#125,
9NXl5,8/8/8/1p2BK2/1P3P1p/2Pk4/8/8 b - - 0 46,g6f5 h4h3 f5e6 h3h2 f4f5 h2h1q,531,85,100,403,advancedPawn bishopEndgame crushing endgame long promotion,https://lichess.org/HM44xbgP#91,
55m66,6k1/8/1pPp4/6b1/8/1K2p3/8/8 w - - 0 57,e4e3 c6c7 g8g7 c7c8q,535,87,100,334,advancedPawn bishopEndgame crushing endgame master promotion short,https://lichess.org/yGildlfX/black#112,
4hLif,8/8/7p/1k4p1/p2p1pP1/P1bP1P1P/1BK5/8 w - - 32 58,c5b5 b2c3 d4c3 c2c3,544,87,98,1145,bishopEndgame crushing endgame short,https://lichess.org/BtYTmwI1/black#114,
8gUNL,8/8/1kp3B1/2p2p1p/P1K1pPbP/1PP1P1P1/8/8 b - - 0 36,c2c3 g4e2,563,88,100,238,bishopEndgame endgame mate mateIn1 oneMove,https://lichess.org/imCVW6LS#71,
2sXlB,8/1p6/3K1P2/1k6/1pp5/1b6/8/8 w - - 0 76,c5c4 f6f7 c4c3 f7f8q,568,101,97,344,advancedPawn advantage bishopEndgame endgame master promotion short,https://lichess.org/FYnxIuC4/black#150,
9ezWS,8/5k2/1b1P1Bp1/6Kp/1p5P/1P4P1/8/8 b - - 4 66,e5f6 b6e3,573,90,100,80,bishopEndgame endgame master mate mateIn1 oneMove,https://lichess.org/Y7qhiqxc#131,
4v4dB,8/7p/pB3pp1/1p1bp3/5kP1/5P1P/1P3K2/8 w - - 3 37,g5f4 b6e3,575,97,99,788,bishopEndgame endgame mate mateIn1 oneMove,https://lichess.org/entLtBOD/black#72,
6afkw,8/k7/3p4/PB1Pp3/4Pp1p/5Pp1/3K2P1/8 b - - 5 53,e1d2 h4h3 g2h3 g3g2,581,85,100,430,advancedPawn bishopEndgame crushing endgame short,https://lichess.org/RK9pHvzS#105,
EQ5Dk,8/8/8/p1P1p3/4bk1p/P7/2B4K/8 w - - 0 58,c6e4 c2e4 f4e4 c5c6,587,102,100,50,bishopEndgame crushing endgame short,https://lichess.org/OMDwhRq0/black#114,
6VvZa,8/8/3K4/4P3/8/3pk3/4p3/4B3 b - - 2 66,e6d6 d3d2 e1d2 e3d2,593,84,100,97,advancedPawn bishopEndgame crushing endgame master short,https://lichess.org/VJzUXRxF#131,
kox7e,8/8/1p3b1p/p2k2p1/P2P1p2/1P3P1P/4K1P1/B7 b - - 0 44,d3e2 f6d4 a1d4 d5d4,595,88,100,109,bishopEndgame crushing endgame short,https://lichess.org/jJBGzLWU#87,
gNfGf,8/8/3K4/3p1P2/2kP4/8/b4P2/8 w - - 1 56,b5c4 f5f6 a2b1 f6f7,604,94,100,482,advancedPawn bishopEndgame crushing endgame short,https://lichess.org/B4MtP6W5/black#110,
etwQt,8/8/8/4p3/4P1P1/7k/1pK5/b7 w - - 0 50,h4h3 g4g5 h3h4 g5g6,605,90,100,214,bishopEndgame crushing endgame quietMove short,https://lichess.org/K3DaF4dC/black#98,
QI0xU,2B5/8/3p1k2/K2P1P1P/P5p1/8/8/8 b - - 1 44,e6c8 g4g3 h5h6 g3g2 a5a6 g2g1q,621,84,100,404,advancedPawn advantage bishopEndgame endgame long promotion,https://lichess.org/JQSGvLD7#87,
6CkCP,2b5/8/1k6/4KP2/8/8/8/8 w - - 3 63,b5b6 f5f6 c8g4 f6f7,625,83,100,108,advancedPawn bishopEndgame crushing endgame master short,https://lichess.org/7hWaTPxF/black#124,
wOk3z,8/Pk6/3b4/4B3/5pK1/5P2/5P2/8 b - - 4 65,d4e5 d6e5 a7a8r b7a8,634,94,100,468,bishopEndgame crushing endgame hangingPiece master short,https://lichess.org/2VFSQ5Bv#129,
RgsWR,8/8/8/5k1b/1p6/1P3PP1/2K5/8 w - - 0 56,f7h5 g3g4 h5g4 f3g4,639,80,100,251,bishopEndgame crushing endgame fork short,https://lichess.org/Z8kyZxMT/black#110,
zibua,8/8/4k1p1/4b1P1/3BK3/8/8/8 b - - 1 65,e3d4 e5d4 e4d4 e6f5 d4e3 f5g5,644,87,97,1617,bishopEndgame crushing endgame long,https://lichess.org/myPrkZou#129,
SuwTy,8/6bp/8/2p5/P1P1K3/1k6/6PP/8 w - - 0 41,b4b3 a4a5 b3c4 a5a6,649,88,97,272,bishopEndgame crushing endgame quietMove short,https://lichess.org/ukCSEcMy/black#80,
KZMzo,8/8/8/1K6/8/1pk5/2p5/2B5 b - - 1 70,f4c1 b3b2 c1b2 c3b2,653,85,100,117,advancedPawn bishopEndgame crushing endgame master short,https://lichess.org/cz62o8rg#139,
SVvVV,8/1K6/2p5/p1P4p/1P5k/8/P7/7b w - - 0 46,a7a5 b4a5 h1d5 a5a6,655,82,100,224,bishopEndgame crushing endgame short,https://lichess.org/eiLER7oH/black#90,
juv4Y,8/3k4/8/4B3/7p/2K2p1P/8/8 b - - 0 54,b8e5 f3f2 c3d3 f2f1q,664,78,100,163,advancedPawn bishopEndgame crushing endgame promotion short,https://lichess.org/VgtOrFZs#107,
IHqpD,4K3/PB3pkp/1B3bp1/8/8/6P1/7P/5b2 b - - 0 51,a6a7 f1b5 b7c6 b5c6,668,78,98,2620,bishopEndgame endgame mate mateIn2 short,https://lichess.org/bY7xeaMv#101,
zmzZb,8/5p1p/2b3p1/1pB1p3/4Pk2/5PbP/4K1P1/8 w - - 8 43,g5f4 c5e3,670,77,100,242,bishopEndgame endgame mate mateIn1 oneMove,https://lichess.org/YNvUPFB2/black#84,
CJAsQ,8/1k6/p5p1/K4p2/P4P2/4B2P/1b3P2/8 b - - 0 37,a2a4 b2c3,678,79,100,122,bishopEndgame endgame master mate mateIn1 oneMove,https://lichess.org/6k4YejpB#73,
XhmCc,8/4B3/3b4/1p1k1p2/1P3Pp1/3K2P1/8/8 w - - 1 49,c7d6 e7d6 d5d6 d3d4 d6e6 d4c5,685,83,100,410,bishopEndgame crushing endgame long zugzwang,https://lichess.org/ikTVyQ1n/black#96,
P0mll,8/p7/1p2p3/4Pk2/2P2Pb1/4K3/7p/7B w - - 0 47,h3h2 h1e4,693,80,100,195,bishopEndgame endgame mate mateIn1 oneMove,https://lichess.org/srROejNl/black#92,
8HJcE,2b5/3P4/p1B1k3/1p5p/1P3p2/5P2/1P3K2/8 b - - 0 51,d6d7 c8d7 c6d7 e6d7,701,80,100,163,bishopEndgame crushing endgame master short,https://lichess.org/WFsOXJEm#101,
ETegz,8/5pk1/6p1/2K5/4P2p/1P6/B4P2/8 b - - 0 42,c4c5 h4h3 b3b4 h3h2 a2d5 h2h1q,709,79,100,185,advancedPawn advantage bishopEndgame endgame long promotion,https://lichess.org/18ea0fJv#83,
oSI3V,8/8/p3k3/Pp1pBp1p/3K3p/6P1/8/8 w - - 0 39,g5h4 g3h4 f5f4 e5f4,711,81,100,258,bishopEndgame crushing endgame short,https://lichess.org/ZU418rbt/black#76,
JNSGR,8/5p2/4p1p1/B3P2p/5P1P/1K1p2P1/4k3/8 b - - 1 44,a4b3 d3d2 a5d2 e2d2,719,97,100,71,advancedPawn bishopEndgame crushing endgame short,https://lichess.org/NjV9Mp3T#87,
lNnP9,8/1p3kbp/p5p1/4P3/2p1p3/P1B5/1P2K1PP/8 w - - 2 31,g8f7 e5e6 f7e6 c3g7,722,81,100,312,advantage bishopEndgame deflection discoveredAttack endgame short,https://lichess.org/0mrlhjWX/black#60,
JHjT5,8/3p2k1/B3p2p/2p1P1pK/8/1P6/P1P3bP/8 b - - 0 29,c4a6 g2f3,726,79,100,185,bishopEndgame endgame mate mateIn1 oneMove,https://lichess.org/esnXP4qm#57,
AXLZF,8/8/p4b2/Bpp1kP2/2p1P2p/P1P1K2P/8/8 w - - 2 46,d6e5 a5c7,732,95,100,83,bishopEndgame endgame mate mateIn1 oneMove,https://lichess.org/l9wgwX0n/black#90,
oFDV1,8/8/2K1k3/3p1b2/1P1P1P2/8/8/8 w - - 3 63,e4f5 b4b5 f5d3 b5b6 e6f5 b6b7,737,81,100,215,advancedPawn bishopEndgame crushing endgame long master quietMove,https://lichess.org/g0EuGDIT/black#124,
aF9E3,8/pp1k4/3B3p/2pK1Pp1/2Pp2P1/1P5P/P7/8 b - - 0 39,g3d6 d4d3 d6c5 d3d2,740,77,100,277,advancedPawn advantage bishopEndgame endgame short,https://lichess.org/scifg2Ck#77,
DnEZp,8/8/4KB2/5P2/p1kb4/8/8/8 w - - 0 44,a5a4 f6d4 c4d4 f5f6 a4a3 f6f7 a3a2 f7f8q,746,79,100,191,advancedPawn bishopEndgame crushing endgame master promotion veryLong,https://lichess.org/CwiihxoN/black#86,
YgiAw,8/6b1/3k2P1/1p3P2/2B5/8/P3K3/8 b - - 0 43,e6c4 b5c4 f5f6 g7f6,771,80,100,335,bishopEndgame crushing endgame hangingPiece master short,https://lichess.org/k0Qp7HUh#85,
nyyes,2b5/6p1/1p2k2p/1P1p4/5KPP/3BP3/8/8 w - - 2 43,b7c8 d3f5 e6e7 f5c8,777,80,100,116,bishopEndgame crushing endgame short skewer,https://lichess.org/ryNVlV4H/black#84,
DTKKI,8/8/K4kp1/Pp1P3p/5P1P/3b1B2/8/8 b - - 0 46,b6a6 b5b4 a6b6 b4b3 b6c7 b3b2,783,79,100,386,advancedPawn bishopEndgame crushing discoveredAttack endgame long,https://lichess.org/345mdFK7#91,
YYxnb,8/8/5B2/8/3p4/2p5/2K1k3/8 b - - 5 58,d8f6 d4d3 c2c3 d3d2,787,103,100,33,advancedPawn bishopEndgame crushing endgame short,https://lichess.org/HPzUyOkm#115,
M8siO,8/8/1P6/2P2k2/1Pb3p1/4b1P1/8/4K3 w - - 0 46,d4e3 b6b7 e3d4 b7b8q,792,87,100,119,advancedPawn bishopEndgame crushing endgame promotion short,https://lichess.org/P16aJioA/black#90,
ifgds,2b5/2P5/1k1KB3/p4p2/5P2/8/8/8 b - - 1 57,d5e6 c8e6 c7c8q e6c8,797,80,100,263,bishopEndgame crushing endgame short,https://lichess.org/rBEpaWO8#113,
v2Wm0,8/2p2B2/1p1k1p1p/p7/2P5/1b2KP2/1P4PP/8 w - - 1 31,c2b3 c4c5 d6c5 f7b3,801,79,100,184,advantage bishopEndgame discoveredAttack endgame short,https://lichess.org/ZAmc0Abe/black#60,
CpgwK,8/5P2/4K3/8/8/b7/1p6/1Bk5 b - - 0 68,f6f7 c1b1 f7f8q a3f8,822,79,100,93,bishopEndgame crushing endgame hangingPiece short,https://lichess.org/dN5QVxKO#135,
8jG2E,4b3/8/2p3p1/p1Pp3p/1P3P2/k1K3P1/7P/8 w - - 0 42,a7a5 b4a5 e8d7 a5a6 d7c8 a6a7,838,95,100,43,advancedPawn bishopEndgame crushing endgame long,https://lichess.org/Ee26nQFD/black#82,
q8Dc6,8/2k5/8/P1K5/3p1p2/5B2/1PP5/6b1 b - - 0 51,c4c5 d4d3 c5d5 d3c2,851,77,100,405,advancedPawn bishopEndgame crushing discoveredAttack endgame master masterVsMaster short,https://lichess.org/X38OdGq3#101,
5g91M,8/3k1K2/7p/3PP2P/8/6b1/8/8 w - - 7 56,h4g3 e5e6 d7d6 e6e7,866,117,100,25,advancedPawn bishopEndgame crushing endgame master short,https://lichess.org/0HKT6Jjs/black#110,
zWeeY,8/1pk5/p1p2p1p/2K2PbP/PPPB2P1/8/8/8 b - - 0 40,a3a4 b7b6,874,145,100,22,bishopEndgame endgame mate mateIn1 oneMove,https://lichess.org/BPQvTxPI#79,
Ln5W7,8/8/1B6/5k2/P5p1/2b2p2/5P2/6K1 w - - 1 34,g7c3 a4a5 f5e5 a5a6 e5d6 a6a7,879,80,100,347,advancedPawn bishopEndgame crushing endgame long quietMove,https://lichess.org/OtycZOLa/black#66,
Iz1tQ,2b5/6pp/1kP2p2/1B6/1PK5/4P3/6PP/8 b - - 2 49,c3c4 c8e6 c4d4 b6b5,882,77,100,129,advantage bishopEndgame deflection endgame master short,https://lichess.org/jhRhbFmn#97,
R1oIe,8/2b5/2P5/4k1Bp/4p3/4K2P/8/8 w - - 6 45,d5e5 g5f4 e5d5 f4c7,887,77,100,148,bishopEndgame crushing endgame short skewer,https://lichess.org/az7zLmmD/black#88,
BbdjN,8/8/6p1/3b1p1p/pKB1k2P/P3P1P1/5P2/8 b - - 0 46,e2c4 d5c4 b4c4 e4f3 c4b5 f3f2,892,75,100,236,advantage bishopEndgame endgame long,https://lichess.org/RZHHpiEG#91,
RRPUm,8/p6k/1p1PK3/2b5/P7/8/7P/8 w - - 1 66,a3c5 d6d7 c5e7 e6e7,902,84,100,39,advancedPawn bishopEndgame crushing endgame master short,https://lichess.org/Ogit793V/black#130,
AzNuw,8/7p/4k1p1/4p3/pB1pB3/P2K2P1/b6P/8 b - - 4 42,c5b4 a2b1 d3c4 b1e4,906,98,100,44,bishopEndgame crushing deflection endgame short skewer,https://lichess.org/WA5a8QyE#83,
Q4keg,8/8/5K1P/8/1p6/2k5/2b5/3B4 w - - 2 71,d3c2 d1c2 c3c2 h6h7 b4b3 h7h8q,919,77,100,324,advancedPawn bishopEndgame crushing endgame long promotion,https://lichess.org/8Qn1CGOI/black#140,
5GUF9,8/1b3kp1/p1p2p1p/4p3/1B6/P1P2KPP/1P3P2/8 b - - 0 29,g2g3 c6c5 f3e3 c5b4,945,77,100,196,advantage bishopEndgame discoveredAttack endgame short,https://lichess.org/SN1Ybxvi#57,
CJQnX,5B2/3k4/1Kp2pp1/P6p/4P3/7P/6P1/5b2 w - - 4 44,a6f1 a5a6 f1a6 b6a6,953,76,100,321,bishopEndgame crushing endgame short,https://lichess.org/gp1qHsdJ/black#86,
WrQ4b,8/8/8/5kpK/8/p7/8/1B6 b - - 3 59,a2b1 f5f4 b1a2 g5g4,956,77,100,332,bishopEndgame crushing defensiveMove endgame short,https://lichess.org/PTJLU4MZ#117,
QhrsR,8/1b6/p6p/1p1k4/2p3B1/4K2P/PP6/8 w - - 6 44,e5d5 g4f3 d5c5 f3b7,962,76,100,178,bishopEndgame crushing endgame master short skewer,https://lichess.org/cmGHTNAd/black#86,
EIf6f,8/8/8/8/5Kbp/7k/5P1B/8 b - - 1 58,g3h2 h3h2 f4g4 h4h3 f2f4 h2g2 f4f5 h3h2 f5f6 h2h1q,973,76,100,485,advancedPawn bishopEndgame crushing endgame promotion veryLong,https://lichess.org/sBKn3p19#115,
icpM9,8/2k5/P1B3b1/2p5/1p2p3/1P6/3b2K1/8 w - - 0 39,d6c7 a6a7 c7c6 a7a8q,977,78,100,236,advancedPawn bishopEndgame crushing endgame master promotion short,https://lichess.org/GdOfaVYf/black#76,
GhIoK,8/8/6K1/7p/6kP/8/2p5/2B5 b - - 1 96,g5c1 g4h4 g6f5 h4g3 f5e4 h5h4,997,77,100,316,bishopEndgame crushing defensiveMove endgame long,https://lichess.org/B6GFygWf#191,
9pLqU,8/2b3p1/pk2Kpbp/3B4/PP2p3/6P1/3B1P2/8 w - - 2 42,h5g6 d2e3,1009,76,99,915,bishopEndgame endgame mate mateIn1 oneMove,https://lichess.org/TQ0I1sgd/black#82,
PRfCC,8/8/3kp3/1p1p2P1/1PbP1P2/4p3/6K1/3B4 b - - 1 44,g4d1 e3e2 d1e2 c4e2,1010,76,100,252,advancedPawn bishopEndgame crushing endgame short,https://lichess.org/UDZhgpPP#87,
L7mdH,b7/P7/P4p2/8/5KP1/2k5/8/8 w - - 0 65,c4c3 f4f5 c3b4 f5f6,1021,80,100,54,bishopEndgame crushing endgame master short,https://lichess.org/N3hMWmd6/black#128,
KG8eO,8/8/p7/1p6/3pk1K1/1P6/P4B2/8 b - - 0 50,g3g4 d4d3 f2e1 e4e3,1028,77,100,186,bishopEndgame crushing defensiveMove endgame short,https://lichess.org/qS8jppS7#99,
SEUKJ,8/7p/3Bkpp1/ppPb4/3K1PP1/8/1P5P/8 w - - 1 34,b3d5 f4f5 g6f5 g4f5 e6d7 d4d5,1030,83,100,52,bishopEndgame crushing endgame long,https://lichess.org/jI9MR3rg/black#66,
tyif8,8/1b6/8/2PBP3/3K4/p7/1k6/8 b - - 0 52,f7d5 b7d5 d4d5 a3a2 d5d6 a2a1q,1053,79,100,191,advancedPawn bishopEndgame crushing endgame long promotion,https://lichess.org/QoeND9hm#103,
kY6DN,8/8/8/1Pk2P1p/K6b/P7/7P/8 w - - 1 49,d4c5 a4a5 h4e1 a5a6,1074,75,100,252,bishopEndgame crushing endgame short,https://lichess.org/rB7khpMW/black#96,
vowfX,8/8/6p1/5pB1/4p2P/3p1PP1/2k2K2/8 b - - 1 45,e2f2 d3d2 g5d2 c2d2,1076,76,100,658,advancedPawn bishopEndgame crushing endgame short,https://lichess.org/CU4Qf2ne#89,
U32vl,8/3b3p/3P4/3Kpkp1/8/1B3P2/7P/8 w - - 0 48,g7g5 b3c2 f5f4 c2h7,1083,78,100,1469,bishopEndgame crushing endgame short skewer,https://lichess.org/JgLxZMo2/black#94,
kRnSu,8/8/8/2b3p1/2P5/4pKP1/3kB2P/8 b - - 4 49,g4f3 g5g4 f3e4 d2e2,1086,79,100,83,bishopEndgame crushing deflection endgame short,https://lichess.org/gcGL03vR#97,
bfHDL,8/8/6pp/6Pk/8/2K5/8/2Bb4 w - - 0 50,h7h6 g5h6 g6g5 h6h7,1118,77,100,669,advancedPawn bishopEndgame crushing endgame short,https://lichess.org/dUOL08VY/black#98,
PioaU,8/2k2B2/1pPp2p1/1P2p1Pp/4P2K/7P/3b4/8 b - - 0 50,c4f7 d2e1,1131,77,100,305,bishopEndgame endgame mate mateIn1 oneMove,https://lichess.org/s52O4uxG#99,
b7Vwy,8/2kP4/2B5/1P4p1/2p4p/4p2b/2K5/8 w - - 1 60,b6c7 b5b6 c7b6 d7d8q,1140,77,100,653,advancedPawn attraction bishopEndgame crushing deflection endgame promotion short,https://lichess.org/gCooUWzD/black#118,
dU8ht,8/8/6p1/5p1p/1K2kP2/6P1/p6P/B7 b - - 2 59,b5b4 e4f3 a1f6 f3g2 h2h4 g2g3,1145,74,100,699,bishopEndgame crushing endgame long,https://lichess.org/dJIOgca1#117,
dDcZG,8/2Pk4/pK6/8/1Pb5/8/8/8 w - - 1 58,e7d7 b6b7 c4d5 b7b8,1159,75,100,700,bishopEndgame crushing defensiveMove endgame short,https://lichess.org/FI0qpB7a/black#114,
WH1RD,8/8/8/4K3/4p1Pp/5k2/5P2/4B3 b - - 1 46,d4e5 h4h3 g4g5 h3h2 g5g6 h2h1q,1171,83,100,58,advancedPawn bishopEndgame crushing endgame long promotion,https://lichess.org/dNs0n7df#91,
us1ER,8/7p/2B3kP/2p3p1/2P3P1/3b1K2/8/8 w - - 1 48,f5d3 c6e4 d3e4 f3e4 g6f6 e4d5,1179,76,100,150,bishopEndgame crushing endgame long,https://lichess.org/zp30UJ8X/black#94,
zcWbX,8/8/8/5K2/1Pk3p1/8/2p5/2B5 b - - 0 70,f4f5 g4g3 f5f4 g3g2,1185,76,100,85,advancedPawn bishopEndgame crushing endgame short,https://lichess.org/fX7WA8b6#139,
WyhuS,6b1/8/p6P/P1K5/2P5/2k5/8/8 w - - 3 58,d3c3 c5b6 c3c4 b6a6,1190,78,100,110,bishopEndgame crushing endgame short,https://lichess.org/Ps44CLbc/black#114,
MgZM5,8/6k1/3p2p1/p3p3/PpPpP2P/1P1P1b2/3K4/3B4 b - - 1 44,c2d1 f3d1 d2d1 g7h6 d1e1 h6h5,1195,76,99,1022,bishopEndgame crushing endgame long,https://lichess.org/UPGD4A3t#87,
9CrYm,4b3/7p/pKp2P2/P2k2P1/7P/8/8/8 w - - 4 61,e5d5 b6a6 c6c5 a6b6 c5c4 a5a6,1201,76,100,471,advantage bishopEndgame endgame long,https://lichess.org/CrgpPE5n/black#120,
NiQhR,3b4/8/2PKB3/6p1/6P1/6kp/8/8 b - - 1 63,c5d6 h3h2 e6d5 g3g4,1206,76,100,1657,advancedPawn bishopEndgame crushing endgame short,https://lichess.org/z7o3dMOi#125,
lX4OP,8/2K5/1p1PBk2/8/P5P1/5b2/5b2/8 w - - 5 61,g5f6 d6d7 f6e6 d7d8q,1214,75,100,377,advancedPawn bishopEndgame crushing endgame master promotion short,https://lichess.org/onts40XS/black#120,
InqP4,8/8/5K2/3k4/p3bP2/4P2P/1P6/8 b - - 5 40,g5f6 d5c4 f4f5 c4b3,1225,77,99,945,bishopEndgame crushing endgame master short,https://lichess.org/zkTLXHr8#79,
3hV4N,8/8/5b2/1pPpp2k/pP2p3/P3p2P/6KB/8 w - - 0 48,f4e3 c5c6 f6d8 h2e5,1238,76,100,261,advantage bishopEndgame endgame short,https://lichess.org/6Kt4IFj6/black#94,
taCQT,8/8/3b2k1/3P4/1B2K1p1/1P6/8/8 b - - 0 68,d2b4 d6b4 e4f4 g6h5,1249,77,100,249,bishopEndgame crushing defensiveMove endgame hangingPiece master short,https://lichess.org/abR2c0X2#135,
UUf4K,4b3/p5k1/4B1p1/1p1P1p2/8/8/PP6/4K3 w - - 1 36,c6e8 d5d6 g7f6 d6d7 e8d7 e6d7,1254,138,100,17,advancedPawn advantage bishopEndgame endgame long,https://lichess.org/2rLhtJIW/black#70,
7VrgX,8/8/3K4/6k1/1p2p1P1/8/8/3B4 b - - 0 65,d5d6 e4e3 d6c5 b4b3 d1b3 e3e2,1258,76,100,219,advancedPawn bishopEndgame crushing endgame long,https://lichess.org/1u2rXdM5#129,
ykH7b,8/8/6k1/3B4/2pK4/2P5/b7/8 w - - 0 68,f6g6 d5c4 a2b1 c4d3 b1d3 d4d3,1269,124,100,39,bishopEndgame crushing endgame exposedKing long,https://lichess.org/5OsyVqr4/black#134,
DQP7j,8/8/3pk1P1/2p4P/1p6/p7/7K/B7 b - - 1 47,c3a1 b4b3 h5h6 b3b2 a1b2 a3b2 h6h7 b2b1q,1272,75,100,858,advancedPawn bishopEndgame crushing endgame promotion trappedPiece veryLong,https://lichess.org/Ud9AhG8p#93,
xyceX,2b5/6p1/4p2p/4PP2/2k3P1/3p4/3K4/8 w - - 1 47,a6c8 f5f6 g7f6 e5f6 e6e5 f6f7,1283,75,100,2207,advancedPawn bishopEndgame crushing endgame long,https://lichess.org/rY1EFYum/black#92,
gvi6u,8/4kBb1/1p2P1K1/pPp3p1/P1P2p2/5P2/8/8 b - - 3 40,f5g6 g5g4 f3g4 f4f3 g6g7 f3f2,1300,78,100,146,advancedPawn bishopEndgame crushing endgame long sacrifice,https://lichess.org/ZRYB0UiZ#79,
